{
  "version": 1,
  "event": "contract.signed",
  "occurred_at": "2026-10-16T12:00:00+05:00",
  "erp_company_id": 118,
  "crm_client_id": 42,
  "deal": {
    "erp_deal_id": 905,
    "number": "D-2026-0905",
    "title": "Поставка оборудования, партия 1",
    "stage": "contract",
    "amount": "125000000.00",
    "currency": "UZS"
  },
  "actor": {
    "type": "staff",
    "name": "Расчётчик"
  },
  "payload": {
    "erp_contract_id": 311,
    "number": "Д-2026/118-1",
    "by": "both"
  }
}
