{
  "version": 1,
  "event": "document.created",
  "occurred_at": "2026-10-17T09:00:05+05:00",
  "erp_company_id": 118,
  "crm_client_id": 42,
  "deal": {
    "erp_deal_id": 905,
    "number": "D-2026-0905",
    "title": "Поставка оборудования, партия 1",
    "stage": "invoiced",
    "amount": "125000000.00",
    "currency": "UZS"
  },
  "actor": {
    "type": "system"
  },
  "payload": {
    "erp_document_id": 4412,
    "kind": "invoice",
    "number": "СЧ-2026-0441",
    "title": "Счёт на оплату СЧ-2026-0441"
  }
}
