{
  "version": 1,
  "event": "deal.won",
  "occurred_at": "2026-12-01T10:00:00+05:00",
  "erp_company_id": 118,
  "crm_client_id": 42,
  "deal": {
    "erp_deal_id": 905,
    "number": "D-2026-0905",
    "title": "Поставка оборудования, партия 1",
    "stage": "won",
    "amount": "125000000.00",
    "currency": "UZS"
  },
  "actor": { "type": "staff", "name": "Финансист" },
  "payload": { "amount": "125000000.00", "currency": "UZS" }
}
